<?xml version="1.0" encoding="utf-8"?>
<Testtakers xmlns:xsi="http://www.w3.org/2001/XMLSchema-instance"
                  xsi:noNamespaceSchemaLocation="https://raw.githubusercontent.com/iqb-berlin/testcenter/18.0.0-beta/definitions/vo_Testtakers.xsd">

  <Metadata>
    <Description>This file contains some logins for testing and works a sample for developers.</Description>
  </Metadata>

  <CustomTexts>
    <CustomText key="somestr">string</CustomText>
  </CustomTexts>

  <Profiles>
    <GroupMonitor>
      <Profile
        id="small"
        label="Superklein"
        blockColumn="hide"
        unitColumn="hide"
        groupColumn="hide"
        bookletColumn="hide"
        bookletStatesColumns=""
        view="small"
        filterLocked="yes"
        filterPending="yes"
      >
        <Filter label="Reduced Booklet" type="equal" field="bookletLabel" value="Reduced Booklet" />
      </Profile>
      <Profile
        id="all"
        label="Alles zeigen"
        blockColumn="show"
        unitColumn="show"
        groupColumn="show"
        bookletColumn="show"
        bookletStatesColumns="level bonus"
        view="full"
        filterLocked="no"
        filterPending="no"
        autoselectNextBlock="no"
      >
      </Profile>
    </GroupMonitor>
  </Profiles>

  <Group id="sample_group" validFrom="1/3/2020 10:00" label="Primary Sample Group">

    <Login mode="run-hot-return" name="test" pw="user123">
      <Booklet codes="xxx yyy">BOOKLET.SAMPLE-1</Booklet>
      <Booklet codes="xxx yyy">BOOKLET.SAMPLE-3</Booklet>
      <Booklet>BOOKLET.SAMPLE-2</Booklet>
      <ViewSettings>
        <theme>Primar</theme>
        <codeInput>
          <type>text-field</type>
          <length>3</length>
        </codeInput>
        <monitorBookletVisibility>hidden</monitorBookletVisibility>
      </ViewSettings>
    </Login>

    <Login mode="run-hot-return" name="test2" pw="user123">
      <Booklet codes="xxx yyy 11111">BOOKLET.SAMPLE-1</Booklet>
      <Booklet codes="xxx yyy 222">BOOKLET.SAMPLE-3</Booklet>
      <Booklet>BOOKLET.SAMPLE-2</Booklet>
      <ViewSettings>
        <theme>Sekundar</theme>
        <codeInput>
          <type>keypad-numbers</type>
          <length>3</length>
        </codeInput>
      </ViewSettings>
    </Login>

    <Login mode="monitor-group" name="test-group-monitor" pw="user123"/>
    <Login mode="monitor-group" name="test-group-monitor-2" pw="user123">
      <Profile id="all" />
      <Profile id="small" />
      <ViewSettings>
        <monitorBookletVisibility>hidden</monitorBookletVisibility>
      </ViewSettings>
    </Login>
    <Login mode="sys-check-login" name="sys-check" />
  </Group>

  <Group id="study_group" label="A group for the study monitor">
    <!-- the study monitor has access to all other groups on the workspace -->
    <Login mode="monitor-study" name="test-study-monitor" pw="user123"/>
  </Group>

  <Group id="review_group" label="A Group of Reviewers">
    <Login mode="run-review" name="test-review" pw="user123">
      <Booklet>BOOKLET.SAMPLE-1</Booklet>
      <Booklet state="bonus:yes">BOOKLET.SAMPLE-2</Booklet>
      <Booklet state="bonus:no">BOOKLET.SAMPLE-2</Booklet>
    </Login>
  </Group>

  <Group id="trial_group" label="A Group for Trials and Demos" validFor="45">
    <Login mode="run-trial" name="test-trial" pw="user123">
      <Booklet>BOOKLET.SAMPLE-1</Booklet>
    </Login>
    <Login mode="run-demo" name="test-demo" pw="user123">
      <Booklet>BOOKLET.SAMPLE-1</Booklet>
    </Login>
    <Login mode="run-simulation" name="test-simulation" pw="user123">
      <Booklet>BOOKLET.SAMPLE-1</Booklet>
    </Login>
  </Group>

  <Group id="passwordless_group" label="A group of persons without password">
    <Login mode="run-hot-restart" name="test-no-pw">
      <Booklet>BOOKLET.SAMPLE-1</Booklet>
    </Login>
    <Login mode="run-trial" name="test-no-pw-trial">
      <Booklet>BOOKLET.SAMPLE-1</Booklet>
    </Login>
  </Group>

  <Group id="expired_group" validTo="1/3/2020 19:30" label="An already expired group">
    <Login mode="run-hot-restart" name="test-expired">
      <Booklet>BOOKLET.SAMPLE-1</Booklet>
    </Login>
    <Login mode="monitor-group" name="expired-group-monitor" pw="user123"/>
    <Login mode="monitor-study" name="expired-study-monitor" pw="user123"/>
  </Group>

  <Group id="future_group" validFrom="26/3/2030 9:00" label="An not yet active group">
    <Login mode="run-hot-restart" name="test-future">
      <Booklet>BOOKLET.SAMPLE-1</Booklet>
    </Login>
  </Group>

</Testtakers>
