<?xml version="1.0" encoding="utf-8"?>
<Testtakers xmlns:xsi="http://www.w3.org/2001/XMLSchema-instance" xsi:noNamespaceSchemaLocation="https://raw.githubusercontent.com/iqb-berlin/testcenter/17.3.0/definitions/vo_Testtakers.xsd">

  <Metadata>
    <Description>Logins f√ºr Cypress Test: Session-Management</Description>
  </Metadata>

  <CustomTexts>
    <CustomText key="app_title">TEST TESTCENTER</CustomText>
  </CustomTexts>

  <Group id="login-variants" label="Login-Variants">
    <Login mode="run-demo" name="SM-1" pw="">
      <Booklet>CY-Bklt_rundemo</Booklet>
    </Login>
    <Login mode="run-demo" name="SM-2" pw="101">
      <Booklet>CY-Bklt_rundemo</Booklet>
    </Login>
    <Login mode="run-demo" name="SM-3">
      <Booklet>CY-Bklt_rundemo</Booklet>
      <Booklet>CY-Bklt_SM</Booklet>
    </Login>
    <Login mode="run-demo" name="SM-4">
      <Booklet>CY-Bklt_rundemo</Booklet>
    </Login>
    <Login mode="run-demo" name="SM-5" pw="102">
      <Booklet codes="as_code01">CY-Bklt_rundemo</Booklet>
    </Login>
    <Login mode="run-demo" name="SM-6">
      <Booklet codes="as_code02">CY-Bklt_rundemo</Booklet>
    </Login>
  </Group>

  <Group id="hote-modes" label="Hote-Modes">
    <Login mode="run-hot-return" name="SM-7" pw="201">
      <Booklet>CY-Bklt_SM</Booklet>
    </Login>
    <Login mode="run-hot-return" name="SM-8" pw="202">
      <Booklet>CY-Bklt_SM</Booklet>
    </Login>
    <Login mode="run-hot-restart" name="SM-9" pw="203">
      <Booklet>CY-Bklt_SM</Booklet>
    </Login>
  </Group>

  <Group id="valid-from-login" validFrom="1/6/2023 10:00" label="Valid-From-Login">
    <Login mode="run-hot-restart" name="SM-10" pw="123">
      <Booklet>CY-Bklt_rundemo</Booklet>
    </Login>
  </Group>

  <Group id="valid-to-login" validTo="1/6/2023 10:00" label="Valid-To-Login">
    <Login mode="run-hot-restart" name="SM-11" pw="123">
      <Booklet>CY-Bklt_rundemo</Booklet>
    </Login>
  </Group>

  <Group id="valid-for-login" validFor="10" label="Valid-For-Login">
    <Login mode="run-hot-return" name="SM-12" pw="123">
      <Booklet>CY-Bklt_rundemo</Booklet>
    </Login>
  </Group>

</Testtakers>
