<?xml version="1.0" encoding="utf-8"?>
<Testtakers xmlns:xsi="http://www.w3.org/2001/XMLSchema-instance" xsi:noNamespaceSchemaLocation="https://raw.githubusercontent.com/iqb-berlin/testcenter/17.3.0/definitions/vo_Testtakers.xsd">

  <Metadata>
    <Description>Logins f√ºr Cypress Test: Booklet-Config</Description>
  </Metadata>

  <CustomTexts>
    <CustomText key="app_title">TEST TESTCENTER</CustomText>
  </CustomTexts>

  <Group id="bklt-config" label="Bklt-Config">
    <Login mode="run-hot-restart" name="Bklt_Config-1" pw="123">
      <Booklet>CY-BkltConfigDefaults</Booklet>
    </Login>
    <Login mode="run-hot-restart" name="Bklt_Config-2" pw="123">
      <Booklet>CY-BkltConfigValue-1</Booklet>
    </Login>
    <Login mode="run-hot-restart" name="Bklt_Config-3" pw="123">
      <Booklet>CY-BkltConfigValue-2</Booklet>
    </Login>
    <Login mode="run-hot-restart" name="Bklt_Config-4" pw="123">
      <Booklet>CY-BkltConfigValue-3</Booklet>
    </Login>
  </Group>

</Testtakers>

