<?xml version="1.0" encoding="utf-8"?>
<Testtakers xmlns:xsi="http://www.w3.org/2001/XMLSchema-instance" xsi:noNamespaceSchemaLocation="https://raw.githubusercontent.com/iqb-berlin/testcenter/17.3.0/definitions/vo_Testtakers.xsd">

  <Metadata>
    <Description>Logins f√ºr Cypress Test: Test-Controller</Description>
  </Metadata>

  <CustomTexts>
    <CustomText key="app_title">TEST TESTCENTER</CustomText>
  </CustomTexts>

  <Group id="demo" label="Demo">
    <Login mode="run-demo" name="Test_Ctrl-1" pw="123">
      <Booklet>CY-Bklt_rundemo</Booklet>
    </Login>
  </Group>

  <Group id="review" label="Review">
    <Login mode="run-review" name="Test_Ctrl-2" pw="123">
      <Booklet>CY-Bklt_runreview</Booklet>
    </Login>
  </Group>

  <Group id="hot-return" label="Hot-Return">
    <Login mode="run-hot-return" name="Test_Ctrl-3" pw="123">
      <Booklet>CY-Bklt_runhotret</Booklet>
    </Login>
    <Login mode="run-hot-return" name="Test_Ctrl-4" pw="123">
      <Booklet>CY-Bklt_runhotret</Booklet>
    </Login>
    <Login mode="run-hot-return" name="Test_Ctrl-5" pw="123">
      <Booklet>CY-Bklt_runhotret</Booklet>
    </Login>
    <Login mode="run-hot-return" name="Test_Ctrl-6" pw="123">
      <Booklet>CY-Bklt_runhotret</Booklet>
    </Login>
  </Group>

  <Group id="hot-restart" label="Hot-Restart">
    <Login mode="run-hot-restart" name="Test_Ctrl-7" pw="123">
      <Booklet>CY-Bklt_runhotres</Booklet>
    </Login>
    <Login mode="run-hot-restart" name="Test_Ctrl-8" pw="123">
      <Booklet>CY-Bklt_runhotres</Booklet>
    </Login>
    <Login mode="run-hot-restart" name="Test_Ctrl-9" pw="123">
      <Booklet>CY-Bklt_runhotres</Booklet>
    </Login>
  </Group>

  <Group id="time-restr" label="Time-Restr">
    <Login mode="run-hot-return" name="Test_Ctrl-10" pw="123">
      <Booklet>CY-Bklt_TimeRestr</Booklet>
    </Login>
    <Login mode="run-hot-return" name="Test_Ctrl-11" pw="123">
      <Booklet>CY-Bklt_TimeRestr</Booklet>
    </Login>
    <Login mode="run-hot-restart" name="Test_Ctrl-12" pw="123">
      <Booklet>CY-Bklt_TimeRestr</Booklet>
    </Login>
    <Login mode="run-demo" name="Test_Ctrl-13" pw="123">
      <Booklet>CY-Bklt_TimeRestr</Booklet>
    </Login>
    <Login mode="run-review" name="Test_Ctrl-14" pw="123">
      <Booklet>CY-Bklt_TimeRestr</Booklet>
    </Login>
    <Login mode="run-hot-restart" name="Test_Ctrl-15" pw="123">
      <Booklet>CY-Bklt_LeaveVal1</Booklet>
    </Login>
    <Login mode="run-hot-restart" name="Test_Ctrl-16" pw="123">
      <Booklet>CY-Bklt_LeaveVal2</Booklet>
    </Login>
    <Login mode="run-hot-restart" name="Test_Ctrl-17" pw="123">
      <Booklet>CY-Bklt_LeaveVal3</Booklet>
    </Login>
  </Group>

  <Group id="tslt-restr" label="Tslt-Restr">
    <!--Nav-Restriction-->
    <Login mode="run-hot-restart" name="Test_Ctrl-18" pw="123">
      <Booklet>CY-Bklt_NavRestrTslt-1</Booklet>
    </Login>
    <Login mode="run-hot-restart" name="Test_Ctrl-19" pw="123">
      <Booklet>CY-Bklt_NavRestrTslt-2</Booklet>
    </Login>
    <Login mode="run-hot-restart" name="Test_Ctrl-20" pw="123">
      <Booklet>CY-Bklt_NavRestrTslt-3</Booklet>
    </Login>
    <!--Leave-Block-Restriction-->
    <Login mode="run-hot-restart" name="Test_Ctrl-21" pw="123">
      <Booklet>CY-Bklt_LockAfterLeave-1</Booklet>
    </Login>
    <Login mode="run-hot-restart" name="Test_Ctrl-22" pw="123">
      <Booklet>CY-Bklt_LockAfterLeave-2</Booklet>
    </Login>
  </Group>

  <Group id="bklt-cfg-restr" label="Bklt-Cfg-Restr">
    <Login mode="run-hot-restart" name="Test_Ctrl-23" pw="123">
      <Booklet>CY-Bklt_NavRestrBklt-0</Booklet>
    </Login>
    <Login mode="run-hot-restart" name="Test_Ctrl-24" pw="123">
      <Booklet>CY-Bklt_NavRestrBklt-1</Booklet>
    </Login>
    <Login mode="run-hot-restart" name="Test_Ctrl-25" pw="123">
      <Booklet>CY-Bklt_NavRestrBklt-2</Booklet>
    </Login>
    <Login mode="run-hot-restart" name="Test_Ctrl-26" pw="123">
      <Booklet>CY-Bklt_NavRestrBklt-3</Booklet>
    </Login>
  </Group>

</Testtakers>