<?xml version="1.0" encoding="utf-8"?>
<Testtakers xmlns:xsi="http://www.w3.org/2001/XMLSchema-instance" xsi:noNamespaceSchemaLocation="https://raw.githubusercontent.com/iqb-berlin/testcenter/17.0.0/definitions/vo_Testtakers.xsd">

  <Metadata>
    <Description>Logins f√ºr die Cypress Controller-Tests</Description>
  </Metadata>

  <CustomTexts>
    <CustomText key="app_title">TEST TESTCENTER</CustomText>
  </CustomTexts>

  <Group id="rundemo" label="RunDemo">
    <Login mode="run-demo" name="Test_Demo_Ctrl" pw="123">
      <Booklet>CY-Bklt_rundemo</Booklet>
    </Login>
  </Group>

  <Group id="runrev" label="RunReview">
    <Login mode="run-review" name="Test_Review_Ctrl" pw="123">
      <Booklet>CY-Bklt_runreview</Booklet>
    </Login>
  </Group>

  <Group id="runhotret" label="RunHotReturn">
    <Login mode="run-hot-return" name="Test_HotReturn_Ctrl1" pw="123">
      <Booklet>CY-Bklt_runhotret</Booklet>
    </Login>
    <Login mode="run-hot-return" name="Test_HotReturn_Ctrl2" pw="123">
      <Booklet>CY-Bklt_runhotret</Booklet>
    </Login>
    <Login mode="run-hot-return" name="Test_HotReturn_Ctrl3" pw="123">
      <Booklet>CY-Bklt_runhotret</Booklet>
    </Login>
    <Login mode="run-hot-return" name="Test_HotReturn_Ctrl4" pw="123">
      <Booklet>CY-Bklt_runhotret</Booklet>
    </Login>
  </Group>

  <Group id="runhotres" label="RunHotRestart">
    <Login mode="run-hot-restart" name="Test_HotRestart_Ctrl1" pw="123">
      <Booklet>CY-Bklt_runhotres</Booklet>
    </Login>
    <Login mode="run-hot-restart" name="Test_HotRestart_Ctrl2" pw="123">
      <Booklet>CY-Bklt_runhotres</Booklet>
    </Login>
    <Login mode="run-hot-restart" name="Test_HotRestart_Ctrl3" pw="123">
      <Booklet>CY-Bklt_runhotres</Booklet>
    </Login>
    <Login mode="run-hot-restart" name="Test_HotRestart_Ctrl4" pw="123">
      <Booklet>CY-Bklt_runhotres</Booklet>
    </Login>
  </Group>

  <Group id="SM_LoginPossibilities" label="Sessionmanagement Login Possibilities">
    <Login mode="run-demo" name="without_pw" pw="">
      <Booklet>CY-Bklt_rundemo</Booklet>
    </Login>
    <Login mode="run-demo" name="with_pw" pw="101">
      <Booklet>CY-Bklt_rundemo</Booklet>
    </Login>
    <Login mode="run-demo" name="as_link">
      <Booklet>CY-Bklt_rundemo</Booklet>
      <Booklet>CY-Bklt_SM</Booklet>
    </Login>
    <Login mode="run-demo" name="as_link_immediate">
      <Booklet>CY-Bklt_rundemo</Booklet>
    </Login>
    <Login mode="run-demo" name="as_code1" pw="102">
      <Booklet codes="as_code01">CY-Bklt_rundemo</Booklet>
    </Login>
    <Login mode="run-demo" name="as_code2">
      <Booklet codes="as_code02">CY-Bklt_rundemo</Booklet>
    </Login>
  </Group>


  <Group id="SM_HotModes" label="SessionManagement Hot-Modes-Test Logins">
    <Login mode="run-hot-return" name="hret1" pw="201">
      <Booklet>CY-Bklt_SM</Booklet>
    </Login>
    <Login mode="run-hot-return" name="hret2" pw="202">
      <Booklet>CY-Bklt_SM</Booklet>
    </Login>
    <Login mode="run-hot-restart" name="hres1" pw="203">
      <Booklet>CY-Bklt_SM</Booklet>
    </Login>
    <Login mode="monitor-group" name="group-monitor" pw="301"/>
    <Login mode="monitor-study" name="tsm" pw="401"/>
  </Group>

  <Group id="SM_ValidFromLogin" validFrom="1/6/2023 10:00" label="SessionManagement valid from login">
    <Login mode="run-demo" name="validFrom01" pw="123">
      <Booklet>CY-Bklt_rundemo</Booklet>
    </Login>
  </Group>

  <Group id="SM_ValidToLogin" validTo="1/6/2023 10:00" label="SessionManagement valid to login">
    <Login mode="run-demo" name="validTo01" pw="123">
      <Booklet>CY-Bklt_rundemo</Booklet>
    </Login>
  </Group>

  <Group id="SM_ValidForLogin" validFor="10" label="SessionManagement valid for login">
    <Login mode="run-review" name="validFor01" pw="123">
      <Booklet>CY-Bklt_runreview</Booklet>
    </Login>
  </Group>

  <Group id="SM_syscheck" label="SessionManagement Sys-Check">
    <Login mode="sys-check-login" name="syscheck"/>
  </Group>

  <Group id="bookletConfig" label="booklet config parameter check">
    <Login mode="run-hot-restart" name="bklConfigDefault" pw="123">
      <Booklet>CY-BkltConfigDefaults</Booklet>
    </Login>
    <Login mode="run-hot-restart" name="bklConfigValue1" pw="123">
      <Booklet>CY-BkltConfigValue-1</Booklet>
    </Login>
    <Login mode="run-hot-restart" name="bklConfigValue2" pw="123">
      <Booklet>CY-BkltConfigValue-2</Booklet>
    </Login>
    <Login mode="run-hot-restart" name="bklConfigValue3" pw="123">
      <Booklet>CY-BkltConfigValue-3</Booklet>
    </Login>
  </Group>

  <Group id="testletRestrictions" label="testlet restriction parameter check">
    <Login mode="run-hot-return" name="TimeRestr_HotRet1" pw="123">
      <Booklet>CY-Bklt_TimeRestr</Booklet>
    </Login>
    <Login mode="run-hot-return" name="TimeRestr_HotRet2" pw="123">
      <Booklet>CY-Bklt_TimeRestr</Booklet>
    </Login>
    <Login mode="run-hot-restart" name="TimeRestr_HotRes1" pw="123">
      <Booklet>CY-Bklt_TimeRestr</Booklet>
    </Login>
    <Login mode="run-demo" name="TimeRestr_Demo1" pw="123">
      <Booklet>CY-Bklt_TimeRestr</Booklet>
    </Login>
    <Login mode="run-review" name="TimeRestr_Review1" pw="123">
      <Booklet>CY-Bklt_TimeRestr</Booklet>
    </Login>
    <Login mode="run-hot-restart" name="LeaveVal1" pw="123">
      <Booklet>CY-Bklt_LeaveVal1</Booklet>
    </Login>
    <Login mode="run-hot-restart" name="LeaveVal2" pw="123">
      <Booklet>CY-Bklt_LeaveVal2</Booklet>
    </Login>
    <Login mode="run-hot-restart" name="LeaveVal3" pw="123">
      <Booklet>CY-Bklt_LeaveVal3</Booklet>
    </Login>
    <Login mode="run-hot-restart" name="NavRestrVal1" pw="123">
      <Booklet>CY-Bklt_NavRestrVal1</Booklet>
    </Login>
    <Login mode="run-hot-restart" name="NavRestrVal2" pw="123">
      <Booklet>CY-Bklt_NavRestrVal2</Booklet>
    </Login>
    <Login mode="run-hot-restart" name="NavRestrVal3" pw="123">
      <Booklet>CY-Bklt_NavRestrVal3</Booklet>
    </Login>
    <Login mode="run-hot-restart" name="RestrLockAfterLeave1" pw="123">
      <Booklet>CY-Bklt_LockAfterLeave-1</Booklet>
    </Login>
    <Login mode="run-hot-restart" name="RestrLockAfterLeave2" pw="123">
      <Booklet>CY-Bklt_LockAfterLeave-2</Booklet>
    </Login>
  </Group>

</Testtakers>